India,"India India, officially the Republic of India (ISO: Bhārat Gaṇarājya), is a country in South Asia. It is the seventh-largest country by area; the most populous country as of June 2023; and from the time of its independence in 1947, the world's most populous democracy. Bounded by the Indian Ocean on the south, the Arabian Sea on the southwest, and the Bay of Bengal on the southeast, it shares land borders with Pakistan to the west; China, Nepal, and Bhutan to the north; and Bangladesh and Myanmar to the east. In the Indian Ocean, India is in the vicinity of Sri Lanka and the Maldives; its Andaman and Nicobar Islands share a maritime border with Thailand, Myanmar, and Indonesia. Republic of IndiaBhārat Gaṇarājya(see other regional names) Flag State emblem Motto: ""Satyameva Jayate"" (Sanskrit)""Truth Alone Triumphs""Anthem: ""Jana Gana Mana"" (Hindi)""Thou Art the Ruler of the Minds of All People"" National song: ""Vande Mataram"" (Sanskrit)""I Bow to Thee, Mother"" Territory controlled by India shown in dark green; territory claimed but not controlled shown in light greenCapitalNew Delhi28°36′50″N 77°12′30″ELargest city Mumbai (city proper) Delhi (metropolitan area) Official languagesHindiEnglishRecognised regional languages State level and Eighth Schedule 8th Scheduled AssameseBengaliBoroDogriGujaratiHindiKannadaKashmiriKonkaniMaithiliMalayalamManipuriMarathiNepaliOdiaPunjabiSanskritSantaliSindhiTamilTeluguUrduState level KokborokLepchaMizoSikkimeseall the 8th scheduled languages (except Sindhi, Kashmiri and Dogri) Native languages447 languagesReligion (2011)79.8% Hinduism14.2% Islam2.3% Christianity1.7% Sikhism0.7% Buddhism0.4% Jainism0.23% unaffiliated0.65% otherDemonym(s)IndianothersGovernmentFederal parliamentary constitutional republic• President Droupadi Murmu• Vice President Jagdeep Dhankhar• Prime Minister Narendra Modi• Lok Sabha Speaker Om Birla• Chief Justice Dhananjaya Y. Chandrachud LegislatureParliament• Upper houseRajya Sabha• Lower houseLok SabhaIndependence from the United Kingdom• Dominion 15 August 1947• Republic 26 January 1950• Last polity admitted 16 May 1975 Area • Total3,287,263 km2 (1,269,219 sq mi) (7th)• Water (%)9.6Population• 2023 estimate 1,428,627,663 (1st)• 2011 census1,210,854,977 (2nd)• Density421.2/km2 (1,090.9/sq mi) (30th)GDP (PPP)2023 estimate• Total $13.033 trillion (3rd)• Per capita $9,073 (127th)GDP (nominal)2023 estimate• Total $3.737 trillion (5th)• Per capita $2,601 (139th)Gini (2011)35.7mediumHDI (2021) 0.633medium · 132ndCurrencyIndian rupee (₹) (INR)Time zoneUTC+05:30 (IST)DST is not observed.Date formatdd-mm-yyyyDriving sideleftCalling code+91ISO 3166 codeINInternet TLD.in (others) Modern humans arrived on the Indian subcontinent from Africa no later than 55,000 years ago. Their long occupation, initially in varying forms of isolation as hunter-gatherers, has made the region highly diverse, second only to Africa in human genetic diversity. Settled life emerged on the subcontinent in the western margins of the Indus river basin 9,000 years ago, evolving gradually into the Indus Valley Civilisation of the third millennium BCE. By 1200 BCE, an archaic form of Sanskrit, an Indo-European language, had diffused into India from the northwest. Its evidence today is found in the hymns of the Rigveda. Preserved by an oral tradition that was resolutely vigilant, the Rigveda records the dawning of Hinduism in India. The Dravidian languages of India were supplanted in the northern and western regions. By 400 BCE, stratification and exclusion by caste had emerged within Hinduism, and Buddhism and Jainism had arisen, proclaiming social orders unlinked to heredity. Early political consolidations gave rise to the loose-knit Maurya and Gupta Empires based in the Ganges Basin. Their collective era was suffused with wide-ranging creativity, but also marked by the declining status of women, and the incorporation of untouchability into an organised system of belief. In South India, the Middle kingdoms exported Dravidian-languages scripts and religious cultures to the kingdoms of Southeast Asia. In the early medieval era, Christianity, Islam, Judaism, and Zoroastrianism became established on India's southern and western coasts. Muslim armies from Central Asia intermittently overran India's northern plains, eventually founding the Delhi Sultanate, and drawing northern India into the cosmopolitan networks of medieval Islam. In the 15th century, the Vijayanagara Empire created a long-lasting composite Hindu culture in south India. In the Punjab, Sikhism emerged, rejecting institutionalised religion. The Mughal Empire, in 1526, ushered in two centuries of relative peace, leaving a legacy of luminous architecture. Gradually expanding rule of the British East India Company followed, turning India into a colonial economy, but also consolidating its sovereignty. British Crown rule began in 1858. The rights promised to Indians were granted slowly, but technological changes were introduced, and modern ideas of education and the public life took root. A pioneering and influential nationalist movement emerged, which was noted for nonviolent resistance and became the major factor in ending British rule. In 1947 the British Indian Empire was partitioned into two independent dominions, a Hindu-majority Dominion of India and a Muslim-majority Dominion of Pakistan, amid large-scale loss of life and an unprecedented migration. India has been a federal republic since 1950, governed through a democratic parliamentary system. It is a pluralistic, multilingual and multi-ethnic society. India's population grew from 361 million in 1951 to almost 1.4 billion in 2022. During the same time, its nominal per capita income increased from US$64 annually to US$2,601, and its literacy rate from 16.6% to 74%. From being a comparatively destitute country in 1951, India has become a fast-growing major economy and a hub for information technology services, with an expanding middle class. It has a space programme. Indian movies, music, and spiritual teachings play an increasing role in global culture. India has substantially reduced its rate of poverty, though at the cost of increasing economic inequality. India is a nuclear-weapon state, which ranks high in military expenditure. It has disputes over Kashmir with its neighbours, Pakistan and China, unresolved since the mid-20th century. Among the socio-economic challenges India faces are gender inequality, child malnutrition, and rising levels of air pollution. India's land is megadiverse, with four biodiversity hotspots. Its forest cover comprises 21.7% of its area. India's wildlife, which has traditionally been viewed with tolerance in India's culture, is supported among these forests, and elsewhere, in protected habitats. This article is issued from Wikipedia. The text is licensed under Creative Commons - Attribution - Sharealike. Additional terms may apply for the media files."
Japan,"Japan Japan (Japanese: 日本, [ɲihoɴ] (listen), Nippon or Nihon, and formally 日本国, Nihonkoku) is an island country in East Asia. It is situated in the northwest Pacific Ocean and is bordered on the west by the Sea of Japan, extending from the Sea of Okhotsk in the north toward the East China Sea, Philippine Sea, and Taiwan in the south. Japan is a part of the Ring of Fire, and spans an archipelago of 14,125 islands, with the five main islands being Hokkaido, Honshu (the ""mainland""), Shikoku, Kyushu, and Okinawa. Tokyo is the nation's capital and largest city, followed by Yokohama, Osaka, Nagoya, Sapporo, Fukuoka, Kobe, and Kyoto. Japan日本国 (Japanese)Nippon-koku or Nihon-koku Flag Imperial Seal Anthem: 君が代Kimigayo""His Imperial Majesty's Reign""State Seal大日本國璽National Seal of Greater JapanTerritory controlled by Japan in dark green; territory claimed but not controlled shown in light greenCapitaland largest cityTokyo35°41′N 139°46′EOfficial languagesJapanese (de facto)Demonym(s)JapaneseGovernmentUnitary parliamentary constitutional monarchy• Emperor Naruhito• Prime Minister Fumio Kishida LegislatureNational Diet• Upper houseHouse of Councillors• Lower houseHouse of RepresentativesFormation• Imperial Dynasty established Between 660 BC and AD 539• Meiji Constitution November 29, 1890• Current constitution May 3, 1947 Area • Total377,975 km2 (145,937 sq mi) (62nd)• Water (%)1.4 (2015)Population• 2022 estimate 124,840,000 (11th)• 2020 census126,226,568• Density330/km2 (854.7/sq mi) (44th)GDP (PPP)2022 estimate• Total $6.139 trillion (4th)• Per capita $49,044 (36th)GDP (nominal)2022 estimate• Total $4.234 trillion (3rd)• Per capita $33,822 (28th)Gini (2018) 33.4mediumHDI (2021) 0.925very high · 19thCurrencyJapanese yen (¥)Time zoneUTC+09:00 (JST)Driving sideleftCalling code+81ISO 3166 codeJPInternet TLD.jp Japan is the eleventh most populous country in the world, as well as one of the most densely populated. About three-fourths of the country's terrain is mountainous, concentrating its highly urbanized population on narrow coastal plains. Japan is divided into 47 administrative prefectures and eight traditional regions. The Greater Tokyo Area is the most populous metropolitan area in the world. Japan has the world's highest life expectancy, though it is experiencing a population decline. Japan has been inhabited since the Upper Paleolithic period (30,000 BC). Between the 4th and 9th centuries, the kingdoms of Japan became unified under an emperor and the imperial court based in Heian-kyō. Beginning in the 12th century, political power was held by a series of military dictators (shōgun) and feudal lords (daimyō) and enforced by a class of warrior nobility (samurai). After a century-long period of civil war, the country was reunified in 1603 under the Tokugawa shogunate, which enacted an isolationist foreign policy. In 1854, a United States fleet forced Japan to open trade to the West, which led to the end of the shogunate and the restoration of imperial power in 1868. In the Meiji period, the Empire of Japan adopted a Western-modeled constitution and pursued a program of industrialization and modernization. Amidst a rise in militarism and overseas colonization, Japan invaded China in 1937 and entered World War II as an Axis power in 1941. After suffering defeat in the Pacific War and two atomic bombings, Japan surrendered in 1945 and came under a seven-year Allied occupation, during which it adopted a new constitution. Under the 1947 constitution, Japan has maintained a unitary parliamentary constitutional monarchy with a bicameral legislature, the National Diet. Japan is a developed country and a great power, with one of the largest domestic product base. Japan has renounced its right to declare war, though it maintains a Self-Defense Force that ranks as one of the world's strongest militaries. A global leader in the automotive, robotics, and electronics industries, the country has made significant contributions to science and technology. It is part of multiple major international and intergovernmental institutions. Japan is considered a cultural superpower as the culture of Japan is well known around the world, including its art, cuisine, film, music, and popular culture, which encompasses prominent manga, anime, and video game industries. This article is issued from Wikipedia. The text is licensed under Creative Commons - Attribution - Sharealike. Additional terms may apply for the media files."
Jesus,"Jesus Jesus (c. 6 to 4 BC – AD 30 or 33), also referred to as Jesus Christ, Jesus of Nazareth, and several other names and titles, was a first-century Jewish preacher and religious leader. He is the central figure of Christianity, the world's largest religion. Most Christians believe Jesus to be the incarnation of God the Son and the awaited messiah, the Christ that is prophesied in the Hebrew Bible. JesusThe Christ Pantocrator of Saint Catherine's Monastery at Mount Sinai, 6th century ADBornc. 6 to 4 BCHerodian Kingdom of Judea, Roman EmpireDiedAD 30 or 33 (aged 33–38)Jerusalem, Judaea, Roman EmpireCause of deathCrucifixionKnown forCentral figure of ChristianityParentsMaryJoseph Part of a series on Jesus in Christianity Christ Christology Names and titles Life of Jesus Gospels Gospel harmony Places Virgin birth Nativity Baptism Ministry Sermon on the Mount Miracles Parables Humiliation Execution Burial Resurrection Ascension Obedience Heavenly Session Intercession Second Coming Relics Jesus in Islam Masih Gospel Names and titles Mary Disciples Death Mahdi End times Background Background to the New Testament Language spoken by Jesus Jesus' race / genealogy Jesus in history Chronology Historical Jesus Historicity (Gospels) Sources for the historicity of Jesus Quest for the historical Jesus Mythology Christ myth theory Criticism Unknown years Perspectives on Jesus Biblical Christian Jewish Talmud Islamic Ahmadi Josephus Tacitus Bar-Serapion Jesus in culture Life in art Depiction Jesuism  Christianity portal  Islam portal Virtually all modern scholars of antiquity agree that Jesus existed historically. Accounts of Jesus' life are contained in the Gospels, especially the four canonical Gospels in the New Testament. Academic research has yielded uncertainty on the historical reliability of the Gospels and how closely they reflect the historical Jesus. Jesus was a Galilean Jew who was circumcised, was baptized by John the Baptist, began his own ministry, and was often referred to as ""rabbi"". Jesus debated with fellow Jews on how to best follow God, engaged in healings, taught in parables, and gathered followers. He was arrested in Jerusalem and tried by the Jewish authorities, turned over to the Roman government, and crucified on the order of Pontius Pilate, the Roman prefect of Judea. After his death, his followers believed he rose from the dead, and the community they formed eventually became the early Christian Church. Accounts of his teachings and life were initially conserved by oral transmission, which was the source of the written Gospels. Christian theology includes the beliefs that Jesus was conceived by the Holy Spirit, was born of a virgin named Mary, performed miracles, founded the Christian Church, died by crucifixion as a sacrifice to achieve atonement for sin, rose from the dead, and ascended into Heaven, from where he will return. Commonly, Christians believe Jesus enables people to be reconciled to God. The Nicene Creed asserts that Jesus will judge the living and the dead, either before or after their bodily resurrection, an event tied to the Second Coming of Jesus in Christian eschatology. The great majority of Christians worship Jesus as the incarnation of God the Son, the second of three prosopons of the Trinity. The birth of Jesus is celebrated annually on 25 December as Christmas. His crucifixion is honored on Good Friday and his resurrection on Easter Sunday. The world's most widely used calendar era—in which the current year is AD 2023 (or 2023 CE)—is based on the approximate birthdate of Jesus. Jesus is also revered in the Baha'i faith, the Druze faith, Islam and Manichaeism. In Islam, Jesus (often referred to by his Quranic name ʿĪsā) is considered the penultimate prophet of God and the messiah, who will return before the Day of Judgement. Muslims believe Jesus was born of the virgin Mary but was neither God nor a son of God. Most Muslims do not believe that he was killed or crucified but that God raised him into Heaven while he was still alive. In contrast, Judaism rejects the belief that Jesus was the awaited messiah, arguing that he did not fulfill messianic prophecies, was not lawfully anointed and was neither divine nor resurrected. This article is issued from Wikipedia. The text is licensed under Creative Commons - Attribution - Sharealike. Additional terms may apply for the media files."
John Calvin,"John Calvin John Calvin (/ˈkælvɪn/; Middle French: Jehan Cauvin; French: Jean Calvin [ʒɑ̃ kalvɛ̃]; 10 July 1509 – 27 May 1564) was a French theologian, pastor and reformer in Geneva during the Protestant Reformation. He was a principal figure in the development of the system of Christian theology later called Calvinism, including its doctrines of predestination and of God's absolute sovereignty in the salvation of the human soul from death and eternal damnation. Calvinist doctrines were influenced by and elaborated upon the Augustinian and other Christian traditions. Various Congregational, Reformed and Presbyterian churches, which look to Calvin as the chief expositor of their beliefs, have spread throughout the world. John CalvinAnonymous portrait, c. 1550BornJehan Cauvin(1509-07-10)10 July 1509Noyon, Picardy, FranceDied27 May 1564(1564-05-27) (aged 54)Geneva, Republic of GenevaEducationUniversity of ParisUniversity of OrléansUniversity of BourgesOccupation(s)Reformer, minister, authorNotable workInstitutes of the Christian Religion (1536)Theological workEraRenaissanceTradition or movement Reformation Calvinism Main interestsSystematic theologyNotable ideasPredestinationRegulative principle of worshipMonergismCovenantalismImputed righteousness Signature Calvin was a tireless polemicist and apologetic writer who generated much controversy. He also exchanged cordial and supportive letters with many reformers, including Philipp Melanchthon and Heinrich Bullinger. In addition to his seminal Institutes of the Christian Religion, Calvin wrote commentaries on most books of the Bible, confessional documents, and various other theological treatises. Calvin was originally trained as a humanist lawyer. He broke from the Roman Catholic Church around 1530. After religious tensions erupted in widespread deadly violence against Protestant Christians in France, Calvin fled to Basel, Switzerland, where in 1536 he published the first edition of the Institutes. In that same year, Calvin was recruited by Frenchman William Farel to join the Reformation in Geneva, where he regularly preached sermons throughout the week. However, the governing council of the city resisted the implementation of their ideas, and both men were expelled. At the invitation of Martin Bucer, Calvin proceeded to Strasbourg, where he became the minister of a church of French refugees. He continued to support the reform movement in Geneva, and in 1541 he was invited back to lead the church of the city. Following his return, Calvin introduced new forms of church government and liturgy, despite opposition from several powerful families in the city who tried to curb his authority. During this period, Michael Servetus, a Spaniard regarded by both Roman Catholics and Protestants as having a heretical view of the Trinity, arrived in Geneva. He was denounced by Calvin and burned at the stake for heresy by the city council. Following an influx of supportive refugees and new elections to the city council, Calvin's opponents were forced out. Calvin spent his final years promoting the Reformation both in Geneva and throughout Europe. This article is issued from Wikipedia. The text is licensed under Creative Commons - Attribution - Sharealike. Additional terms may apply for the media files."
King Arthur,"King Arthur King Arthur (Welsh: Brenin Arthur, Cornish: Arthur Gernow, Breton: Roue Arzhur, French: Roi Arthur) is a legendary king of Britain, and a central figure in the medieval literary tradition known as the Matter of Britain. In Welsh sources, Arthur is portrayed as a leader of the post-Roman Britons in battles against Anglo-Saxon invaders of Britain in the late 5th and early 6th centuries. He first appears in two early medieval historical sources, the Annales Cambriae and the Historia Brittonum, but these date to 300 years after he is supposed to have lived, and most historians who study the period do not consider him a historical figure. His name also occurs in early Welsh poetic sources such as Y Gododdin. The character developed through Welsh mythology, appearing either as a great warrior defending Britain from human and supernatural enemies or as a magical figure of folklore, sometimes associated with the Welsh otherworld Annwn. The legendary Arthur developed as a figure of international interest largely through the popularity of Geoffrey of Monmouth's fanciful and imaginative 12th-century Historia Regum Britanniae (History of the Kings of Britain). Geoffrey depicted Arthur as a king of Britain who defeated the Saxons and established a vast empire. Many elements and incidents that are now an integral part of the Arthurian story appear in Geoffrey's Historia, including Arthur's father Uther Pendragon, the magician Merlin, Arthur's wife Guinevere, the sword Excalibur, Arthur's conception at Tintagel, his final battle against Mordred at Camlann, and final rest in Avalon. The 12th-century French writer Chrétien de Troyes, who added Lancelot and the Holy Grail to the story, began the genre of Arthurian romance that became a significant strand of medieval literature. In these French stories, the narrative focus often shifts from King Arthur himself to other characters, such as various Knights of the Round Table. The themes, events and characters of the Arthurian legend vary widely from text to text, and there is no one canonical version. Arthurian literature thrived during the Middle Ages but waned in the centuries that followed, until it experienced a major resurgence in the 19th century. In the 21st century, the legend continues to have prominence, not only in literature but also in adaptations for theatre, film, television, comics and other media. This article is issued from Wikipedia. The text is licensed under Creative Commons - Attribution - Sharealike. Additional terms may apply for the media files."
Kit (association football),"Kit (association football) In association football, kit (also referred to as a strip or uniform) is the standard equipment and attire worn by players. The sport's rules specify the minimum kit which a player must use, and also prohibit the use of anything that is dangerous to either the player or another participant. Individual competitions may stipulate further restrictions, such as regulating the size of logos displayed on shirts and stating that, in the event of a match between teams with identical or similar colours, the away team must change to different coloured attire. Footballers generally wear identifying numbers on the backs of their shirts. Originally a team of players wore numbers from 1 to 11, corresponding roughly to their playing positions, but at the professional level this has generally been superseded by squad numbering, whereby each player in a squad is allocated a fixed number for the duration of a season. Professional clubs also usually display players' surnames or nicknames on their shirts, above (or, infrequently, below) their squad numbers. Football kit has evolved significantly since the early days of the sport when players typically wore thick cotton shirts, knickerbockers and heavy rigid leather boots. In the twentieth century, boots became lighter and softer, shorts were worn at a shorter length, and advances in clothing manufacture and printing allowed shirts to be made in lighter synthetic fibres with increasingly colourful and complex designs. With the rise of advertising in the 20th century, sponsors' logos began to appear on shirts, and replica strips were made available for fans to purchase, generating significant amounts of revenue for clubs. This article is issued from Wikipedia. The text is licensed under Creative Commons - Attribution - Sharealike. Additional terms may apply for the media files."
