Catholic Church,"Catholic Church The Catholic Church, also known as the Roman Catholic Church, is the largest Christian church, with 1.3 billion baptized Catholics worldwide as of 2019. It is among the world's oldest and largest international institutions, and has played a prominent role in the history and development of Western civilization. The church consists of 24 sui iuris churches, including the Latin Church and 23 Eastern Catholic Churches, which comprise almost 3,500 dioceses and eparchies located around the world. The pope, who is the bishop of Rome, is the chief pastor of the church. The bishopric of Rome, known as the Holy See, is the central governing authority of the church. The administrative body of the Holy See, the Roman Curia, has its principal offices in Vatican City, a small enclave of the Italian city of Rome, of which the pope is head of state. Catholic ChurchEcclesia CatholicaSt. Peter's Basilica, the largest Catholic church building in the worldClassificationCatholicScriptureBibleTheologyCatholic theologyPolityEpiscopalGovernanceHoly See and Roman CuriaPopeFrancisParticular churchessui iurisLatin Church and 23 Eastern Catholic ChurchesDioceses Archdioceses: 640 Dioceses: 2,851 Parishes221,700 approx.RegionWorldwideLanguageEcclesiastical Latin and native languagesLiturgyWestern and EasternHeadquartersVatican CityFounderJesus, according tosacred traditionOrigin1st century Judaea, Roman EmpireMembers1.378 billion (2021)Clergy Bishops: 5,340 Priests: 407,872 Deacons: 49,176 (2021) Hospitals5,500Primary schools95,200Secondary schools43,800Official websitevatican.va Part of a series on theCatholic ChurchSt. Peter's Basilica, Vatican City Overview Pope: Francis Hierarchy History (timeline) Theology Liturgy Sacraments Mary Background Jesus Crucifixion Resurrection Ascension Early Christianity Peter Paul Fathers History of the Catholic Church History of the papacy Ecumenical councils Magisterium Four Marks of the Church One true church Apostolic succession Organisation Holy See Roman Curia College of Cardinals Ecumenical councils Episcopal polity Latin Church Eastern Churches Canon law TheologiesDoctrine God Trinity Father Son Holy Ghost Consubstantialitas Filioque Divinum illud munus Divine law Decalogus Ex Cathedra Deificatio Realms beyond the States of the Church Heaven Purgatory Limbo Hell Paschal mystery Passion of Jesus Crucifixion of Jesus Harrowing of Hell Resurrection Ascension Blessed Virgin Mary Mariology Veneration Immaculate Conception Mater Dei Perpetual virginity Assumption Dormition Titles Queen Apparition Mediatrix Salvation Baptism of desire Baptism of blood Divine grace Outside the Church there is no salvation Infused righteousness Invincible ignorance Justification Means of grace Merit Mortal sin Satisfaction Moral influence Sanctification Synergism Venial sin Ecclesiology College of Bishops Deposit of faith Infallibility of the Church Mystical Body of Christ Papal primacy People of God Perfect community Subsistit in Other teachings Josephology Morality Body Lectures Sexuality Apologetics Amillennialism Original sin Hypostatic union Predestination Seven deadly sins Beatific vision Saints Dogma Texts Bible Old Testament New Testament Official Bible Vulgate Sixtine Vulgate Sixto-Clementine Vulgate Nova Vulgata Peshitta Apostles' Creed Nicene Creed Athanasian Creed Catechism of the Catholic Church Papal bull Apostolic exhortation Epistula Encyclica Philosophy Cardinal Virtues Just war Natural law Catholic ethics Personalism Probabilism Social teaching Philosophy of canon law Philosophers Virtue ethics Schools Augustinianism Scholasticism Thomism Scotism Occamism Christian humanism Molinism Neo-scholasticism Worship Liturgy Eastern Catholic liturgy Mass Divine Liturgy Holy Qurbana Holy Qurbono Liturgy of the Hours Liturgical year Sacraments Baptism Penance Eucharist Confirmation Anointing of the Sick Matrimony Holy orders Prayer Devotions Bible Biblical canon Rites Latin Roman Post-Vatican II Tridentine Use of Sarum Anglican Use Zaire Use Gallican Ambrosian Braga Mozarabic Eastern Antiochene Maronite West Syriac Syro-Malankara Chaldean East Syriac Syro-Malabar Byzantine Armenian Alexandrian Ethiopic Miscellaneous Antipopes Anti-Catholicism Criticism Deism/Pandeism Ecumenism Monasticism Relations with: Islam Judaism Protestantism Societal issues Art Evolution Health care HIV/AIDS Homosexuality Sexual abuse Music Nazi Germany Politics (in the United States) Role in civilization Science Sex and gender roles Slavery the Age of Discovery Links and resources Index Outline Glossary Category Media Templates WikiProject  Vatican City portal  Catholic Church portal Part of a series onChristianity JesusChrist Nativity Baptism Ministry Crucifixion Resurrection Ascension BibleFoundations Old Testament New Testament Gospel Canon Church Creed New Covenant Theology God Trinity Father Son Holy Spirit Apologetics Baptism Christology History of theology Mission Salvation Universalism HistoryTradition Apostles Peter Paul Mary Early Christianity Church Fathers Constantine Councils Augustine Ignatius East–West Schism Crusades Aquinas Reformation Luther DenominationsGroups Catholic Orthodox Protestant Adventist Anabaptist Anglican Baptist Evangelical Holiness Lutheran Methodist Moravian Pentecostal Quaker Calvinism Restorationist Nondenominational Christianity Jehovah's Witness Latter Day Saint Iglesia ni Cristo Related topics Criticism Culture Ecumenism Glossary Index Liturgy Other religions Outline Prayer Sermon Symbolism Worship Glossary Index Outline  Christianity portal The core beliefs of Catholicism are found in the Nicene Creed. The Catholic Church teaches that it is the one, holy, catholic and apostolic church founded by Jesus Christ in his Great Commission, that its bishops are the successors of Christ's apostles, and that the pope is the successor to Saint Peter, upon whom primacy was conferred by Jesus Christ. It maintains that it practises the original Christian faith taught by the apostles, preserving the faith infallibly through scripture and sacred tradition as authentically interpreted through the magisterium of the church. The Roman Rite and others of the Latin Church, the Eastern Catholic liturgies, and institutes such as mendicant orders, enclosed monastic orders and third orders reflect a variety of theological and spiritual emphases in the church. Of its seven sacraments, the Eucharist is the principal one, celebrated liturgically in the Mass. The church teaches that through consecration by a priest, the sacrificial bread and wine become the body and blood of Christ. The Virgin Mary is venerated as the Perpetual Virgin, Mother of God, and Queen of Heaven; she is honoured in dogmas and devotions. Catholic social teaching emphasizes voluntary support for the sick, the poor, and the afflicted through the corporal and spiritual works of mercy. The Catholic Church operates tens of thousands of Catholic schools, universities and colleges, hospitals, and orphanages around the world, and is the largest non-government provider of education and health care in the world. Among its other social services are numerous charitable and humanitarian organizations. The Catholic Church has profoundly influenced Western philosophy, culture, art, music, and science. Catholics live all over the world through missions, diaspora, and conversions. Since the 20th century, the majority have resided in the Southern Hemisphere, partially due to secularization in Europe and increased persecution in the Middle East. The Catholic Church shared communion with the Eastern Orthodox Church until the East–West Schism in 1054, disputing particularly the authority of the pope. Before the Council of Ephesus in AD 431, the Church of the East also shared in this communion, as did the Oriental Orthodox Churches before the Council of Chalcedon in AD 451; all separated primarily over differences in Christology. The Eastern Catholic Churches, who have a combined membership of approximately 18 million, represent a body of Eastern Christians who returned or remained in communion with the pope during or following these schisms for a variety of historical circumstances. In the 16th century, the Reformation led to Protestantism also breaking away. From the late 20th century, the Catholic Church has been criticized for its teachings on sexuality, its doctrine against ordaining women, and its handling of sexual abuse cases involving clergy. This article is issued from Wikipedia. The text is licensed under Creative Commons - Attribution - Sharealike. Additional terms may apply for the media files."
Charles Darwin,"Charles Darwin Charles Robert Darwin FRS FRGS FLS FZS JP (/ˈdɑːrwɪn/ DAR-win; 12 February 1809 – 19 April 1882) was an English naturalist, geologist, and biologist, widely known for his contributions to evolutionary biology. His proposition that all species of life have descended from a common ancestor is now generally accepted and considered a fundamental concept in science. In a joint publication with Alfred Russel Wallace, he introduced his scientific theory that this branching pattern of evolution resulted from a process he called natural selection, in which the struggle for existence has a similar effect to the artificial selection involved in selective breeding. Darwin has been described as one of the most influential figures in human history and was honoured by burial in Westminster Abbey. Charles DarwinFRS FRGS FLS FZS JPDarwin, c. 1854, when he was preparing On the Origin of SpeciesBornCharles Robert Darwin(1809-02-12)12 February 1809Shrewsbury, EnglandDied19 April 1882(1882-04-19) (aged 73)Down, Kent, EnglandResting placeWestminster AbbeyAlma materUniversity of Edinburgh Christ's College, Cambridge (BA, 1831; MA, 1836)Known for The Voyage of the Beagle On the Origin of Species The Descent of Man Spouse Emma Wedgwood ​(m. 1839)​Children10Parents Robert Darwin Susannah Wedgwood Awards FRS (1839) Royal Medal (1853) Wollaston Medal (1859) Copley Medal (1864) Baly Medal (1879) Pour le Mérite, Prussia (1867) Doctor of Laws (Honorary), Cambridge (1877) Scientific careerFieldsNatural history, geologyInstitutionsGeological Society of LondonAcademic advisors John Stevens Henslow Adam Sedgwick InfluencesLyellHumboldtHerschelMalthusInfluencedHookerHuxleySpencerHaeckelAuthor abbrev. (botany)DarwinAuthor abbrev. (zoology)Darwin Signature Darwin's early interest in nature led him to neglect his medical education at the University of Edinburgh; instead, he helped to investigate marine invertebrates. His studies at the University of Cambridge's Christ's College from 1828 to 1831 encouraged his passion for natural science. His five-year voyage on HMS Beagle from 1831 to 1836 established Darwin as an eminent geologist, whose observations and theories supported Charles Lyell's concept of gradual geological change. Publication of his journal of the voyage made Darwin famous as a popular author. Puzzled by the geographical distribution of wildlife and fossils he collected on the voyage, Darwin began detailed investigations and, in 1838, devised his theory of natural selection. Although he discussed his ideas with several naturalists, he needed time for extensive research and his geological work had priority. He was writing up his theory in 1858 when Alfred Russel Wallace sent him an essay that described the same idea, prompting immediate joint submission of both their theories to the Linnean Society of London. Darwin's work established evolutionary descent with modification as the dominant scientific explanation of diversification in nature. In 1871, he examined human evolution and sexual selection in The Descent of Man, and Selection in Relation to Sex, followed by The Expression of the Emotions in Man and Animals (1872). His research on plants was published in a series of books, and in his final book, The Formation of Vegetable Mould, through the Actions of Worms (1881), he examined earthworms and their effect on soil. Darwin published his theory of evolution with compelling evidence in his 1859 book On the Origin of Species. By the 1870s, the scientific community and a majority of the educated public had accepted evolution as a fact. However, many favoured competing explanations that gave only a minor role to natural selection, and it was not until the emergence of the modern evolutionary synthesis from the 1930s to the 1950s that a broad consensus developed in which natural selection was the basic mechanism of evolution. Darwin's scientific discovery is the unifying theory of the life sciences, explaining the diversity of life. This article is issued from Wikipedia. The text is licensed under Creative Commons - Attribution - Sharealike. Additional terms may apply for the media files."
Charlie Chaplin,"Charlie Chaplin Sir Charles Spencer Chaplin KBE (16 April 1889 – 25 December 1977) was an English comic actor, filmmaker, and composer who rose to fame in the era of silent film. He became a worldwide icon through his screen persona, the Tramp, and is considered one of the film industry's most important figures. His career spanned more than 75 years, from childhood in the Victorian era until a year before his death in 1977, and encompassed both adulation and controversy. SirCharlie ChaplinKBEChaplin in the early 1920sBornCharles Spencer Chaplin(1889-04-16)16 April 1889London, EnglandDied25 December 1977(1977-12-25) (aged 88)Corsier-sur-Vevey, SwitzerlandBurial placeCimetière de Corsier-sur-Vevey, Corsier-sur-Vevey, SwitzerlandOccupationsActorcomediandirectorcomposerscreenwriterproducereditorYears active1899–1975WorksFull listSpouses Mildred Harris ​ ​(m. 1918; div. 1920)​ Lita Grey ​ ​(m. 1924; div. 1927)​ Paulette Goddard ​ ​(m. 1936; div. 1942)​ Oona O'Neill ​(m. 1943)​Children11, including Charles, Sydney, Geraldine, Michael, Josephine, Victoria, Eugene and ChristopherParent(s)Charles Chaplin Sr.Hannah HillRelativesChaplin familyWebsitecharliechaplin.comSignature Chaplin's childhood in London was one of poverty and hardship. His father was absent and his mother struggled financially – he was sent to a workhouse twice before age nine. When he was 14, his mother was committed to a mental asylum. Chaplin began performing at an early age, touring music halls and later working as a stage actor and comedian. At 19, he was signed to the Fred Karno company, which took him to the United States. He was scouted for the film industry and began appearing in 1914 for Keystone Studios. He soon developed the Tramp persona and attracted a large fan base. He directed his own films and continued to hone his craft as he moved to the Essanay, Mutual, and First National corporations. By 1918, he was one of the world's best-known figures. In 1919, Chaplin co-founded distribution company United Artists, which gave him complete control over his films. His first feature-length film was The Kid (1921), followed by A Woman of Paris (1923), The Gold Rush (1925), and The Circus (1928). He initially refused to move to sound films in the 1930s, instead producing City Lights (1931) and Modern Times (1936) without dialogue. His first sound film was The Great Dictator (1940), which satirised Adolf Hitler. The 1940s were marked with controversy for Chaplin, and his popularity declined rapidly. He was accused of communist sympathies, and some members of the press and public were scandalised by his involvement in a paternity suit and marriages to much younger women. An FBI investigation was opened, and Chaplin was forced to leave the U.S. and settle in Switzerland. He abandoned the Tramp in his later films, which include Monsieur Verdoux (1947), Limelight (1952), A King in New York (1957), and A Countess from Hong Kong (1967). Chaplin wrote, directed, produced, edited, starred in, and composed the music for most of his films. He was a perfectionist, and his financial independence enabled him to spend years on the development and production of a picture. His films are characterised by slapstick combined with pathos, typified in the Tramp's struggles against adversity. Many contain social and political themes, as well as autobiographical elements. He received an Honorary Academy Award for ""the incalculable effect he has had in making motion pictures the art form of this century"" in 1972, as part of a renewed appreciation for his work. He continues to be held in high regard, with The Gold Rush, City Lights, Modern Times, and The Great Dictator often ranked on lists of the greatest films. This article is issued from Wikipedia. The text is licensed under Creative Commons - Attribution - Sharealike. Additional terms may apply for the media files."
Cretaceous–Paleogene extinction event,"Cretaceous–Paleogene extinction event The Cretaceous–Paleogene (K–Pg) extinction event, also known as the Cretaceous–Tertiary (K–T) extinction, was a sudden mass extinction of three-quarters of the plant and animal species on Earth, approximately 66 million years ago. The event caused the extinction of all non-avian dinosaurs. Most other tetrapods weighing more than 25 kilograms (55 pounds) also became extinct, with the exception of some ectothermic species such as sea turtles and crocodilians. It marked the end of the Cretaceous Period, and with it the Mesozoic era, while heralding the beginning of the Cenozoic era, which continues to this day. Image description from the top to bottom: Artist's rendering of an asteroid a few kilometers across colliding with the Earth. Such an impact can release the equivalent energy of several million nuclear weapons detonating simultaneously; Bali Khila, an eroded hill from the Deccan Traps, which are another hypothesized cause of the K–Pg extinction event; Badlands near Drumheller, Alberta, where erosion has exposed the K–Pg boundary; Wyoming rock with an intermediate claystone layer that contains 1,000 times more iridium than the upper and lower layers. Picture taken at the San Diego Natural History Museum; Complex Cretaceous–Paleogene clay layer (gray) in the Geulhemmergroeve tunnels near Geulhem, The Netherlands (finger is below the actual Cretaceous–Paleogene boundary). In the geologic record, the K–Pg event is marked by a thin layer of sediment called the K–Pg boundary, which can be found throughout the world in marine and terrestrial rocks. The boundary clay shows unusually high levels of the metal iridium, which is more common in asteroids than in the Earth's crust. As originally proposed in 1980 by a team of scientists led by Luis Alvarez and his son Walter, it is now generally thought that the K–Pg extinction was caused by the impact of a massive asteroid 10 to 15 km (6 to 9 mi) wide, 66 million years ago, which devastated the global environment, mainly through a lingering impact winter which halted photosynthesis in plants and plankton. The impact hypothesis, also known as the Alvarez hypothesis, was bolstered by the discovery of the 180 km (112 mi) Chicxulub crater in the Gulf of Mexico's Yucatán Peninsula in the early 1990s, which provided conclusive evidence that the K–Pg boundary clay represented debris from an asteroid impact. The fact that the extinctions occurred simultaneously provides strong evidence that they were caused by the asteroid. A 2016 drilling project into the Chicxulub peak ring confirmed that the peak ring comprised granite ejected within minutes from deep in the earth, but contained hardly any gypsum, the usual sulfate-containing sea floor rock in the region: the gypsum would have vaporized and dispersed as an aerosol into the atmosphere, causing longer-term effects on the climate and food chain. In October 2019, researchers reported that the event rapidly acidified the oceans, producing ecological collapse and, in this way as well, produced long-lasting effects on the climate, and accordingly was a key reason for the mass extinction at the end of the Cretaceous. Other causal or contributing factors to the extinction may have been the Deccan Traps and other volcanic eruptions, climate change, and sea level change. However, in January 2020, scientists reported that climate-modeling of the extinction event favored the asteroid impact and not volcanism. A wide range of terrestrial species perished in the K–Pg extinction, the best-known being the non-avian dinosaurs, along with many mammals, birds, lizards, insects, plants, and all the pterosaurs. In the oceans, the K–Pg extinction killed off plesiosaurs and mosasaurs and devastated teleost fish, sharks, mollusks (especially ammonites, which became extinct), and many species of plankton. It is estimated that 75% or more of all species on Earth vanished. However, the extinction also provided evolutionary opportunities: in its wake, many groups underwent remarkable adaptive radiation—sudden and prolific divergence into new forms and species within the disrupted and emptied ecological niches. Mammals in particular diversified in the Paleogene, evolving new forms such as horses, whales, bats, and primates. The surviving group of dinosaurs were avians, a few species of ground and water fowl, which radiated into all modern species of birds. Among other groups, teleost fish and perhaps lizards also radiated. This article is issued from Wikipedia. The text is licensed under Creative Commons - Attribution - Sharealike. Additional terms may apply for the media files."
Defender (association football),"Defender (association football) In the sport of association football, a defender is an outfield position whose primary role is to stop attacks during the game and prevent the opposition from scoring. Centre-backs are usually positioned in pairs, with one full-back on either side to their left and right, but can be played in threes with or without full-backs. Defenders fall into five main categories: centre-back, sweeper, full-back, Defensive midfielder and wing-back. The centre-back and full-back positions are essential in most modern formations. The sweeper and wing-back roles are more specialised for certain formations dependent on the manager's style of play and tactics. Centre-backs are usually tall and positioned for their ability to win duels in the air. This article is issued from Wikipedia. The text is licensed under Creative Commons - Attribution - Sharealike. Additional terms may apply for the media files."
