Perth,"Perth Perth (Nyungar: Boorloo) is the capital and largest city of the Australian state of Western Australia. It is the fourth most populous city in Australia and Oceania, with a population of 2.1 million (80% of the state) living in Greater Perth in 2020. Perth is part of the South West Land Division of Western Australia, with most of the metropolitan area on the Swan Coastal Plain between the Indian Ocean and the Darling Scarp. The city has expanded outward from the original British settlements on the Swan River, upon which the city's central business district and port of Fremantle are situated. Perth is located on the traditional lands of the Whadjuk Noongar people, where Aboriginal Australians have lived for at least 45,000 years. PerthBoorloo (Nyungar)Western AustraliaClockwise from top: Perth's skyline viewed across the Swan River from South Perth; Elizabeth Quay; Perth Stadium; Kings Park; Cottesloe Beach; WA Museum Boola Bardip and the Crawley Edge BoatshedPerthCoordinates31°57′21″S 115°51′38″EPopulation2,192,229 (2021) (4th) • Density341.5804/km2 (884.689/sq mi)Established4 June 1829Area6,417.9 km2 (2,478.0 sq mi)(GCCSA)Time zoneAWST (UTC+08:00)Location 2,130 km (1,324 mi) from Adelaide 2,652 km (1,648 mi) from Darwin 2,721 km (1,691 mi) from Melbourne 3,087 km (1,918 mi) from Canberra 3,297 km (2,049 mi) from Sydney State electorate(s)Perth (and 41 others)Federal division(s)Perth (and 11 others) Mean max temp Mean min temp Annual rainfall 24.8 °C 77 °F 12.8 °C 55 °F 731.1 mm 28.8 in Captain James Stirling founded Perth in 1829 as the administrative centre of the Swan River Colony. It was named after the city of Perth in Scotland, due to the influence of Stirling's patron Sir George Murray, who had connections with the area. It gained city status in 1856, although the Perth City Council currently governs only a small area around the central business district. The city's population increased substantially as a result of the Western Australian gold rushes in the late 19th century. It has grown steadily since World War II due to a high net migration rate. Post-war immigrants were predominantly from the British Isles and Southern Europe, while more recent arrivals see a growing population of Asian descent. Several mining booms in other parts of Western Australia in the late 20th and early 21st centuries saw Perth become the regional headquarters for large mining operations. Perth contains a number of important public buildings as well as cultural and heritage sites. Notable government buildings include Parliament House, Government House, the Supreme Court Buildings and the Perth Mint. The city is served by Fremantle Harbour and Perth Airport. It was a naval base for the Allies during World War II and today, the Royal Australian Navy's Fleet Base West is located on Garden Island. All five of Western Australia's universities are based in Perth. The city has been ranked as one of the world's most liveable cities, and was classified by the Globalization and World Cities Research Network in 2020 as a Beta global city. As of 2021, Perth is divided into 30 local government areas and consists of more than 350 suburbs. The metropolitan boundaries stretch 123 kilometres (76 mi) from Two Rocks in the north to Singleton in the south, and 62 kilometres (39 mi) east inland to The Lakes. Outside of the central business district, important urban centres within the metropolitan area include Armadale, Fremantle, Joondalup, Midland, and Rockingham. Most of those were originally established as separate settlements and retained a distinct identity after being subsumed into the wider metropolitan area. Mandurah, Western Australia's second-largest city, forms a conurbation with Perth along the coast, though for most purposes it is still considered a separate city. This article is issued from Wikipedia. The text is licensed under Creative Commons - Attribution - Sharealike. Additional terms may apply for the media files."
President of the United States,"President of the United States The president of the United States (POTUS) is the head of state and head of government of the United States. The president directs the executive branch of the federal government and is the commander-in-chief of the United States Armed Forces. President of the United StatesPresidential sealPresidential flagIncumbentJoe Bidensince January 20, 2021 Executive branch of the U.S. government Executive Office of the President Style Mr. President (informal) The Honorable (formal) His Excellency (diplomatic) Type Head of state Head of government Commander-in-chief AbbreviationPOTUSMember of Cabinet Domestic Policy Council National Economic Council National Security Council ResidenceWhite HouseSeatWashington, D.C.AppointerElectoral College or via succession from vice presidencyTerm lengthFour years, renewable onceConstituting instrumentConstitution of the United StatesFormationMarch 4, 1789 (1789-03-04)First holderGeorge WashingtonSalary400,000 United States dollars per yearWebsitewww.whitehouse.gov This article is part of a series on thePolitics of the United States Federal government Constitution of the United States Law Taxation Policy Legislature United States Congress House of Representatives Speaker Kevin McCarthy (R) Majority Leader Steve Scalise (R) Minority Leader Hakeem Jeffries (D) Congressional districts (List of congressional districts) Senate President Kamala Harris (D) President Pro Tempore Patty Murray (D) Majority Leader Chuck Schumer (D) Minority Leader Mitch McConnell (R) Executive President of the United States Joe Biden (D) Vice President of the United States Kamala Harris (D) Cabinet Federal agencies Executive Office Judiciary Supreme Court of the United States Chief Justice John Roberts Thomas Alito Sotomayor Kagan Gorsuch Kavanaugh Barrett Jackson Courts of appeals District courts (list) Other tribunals Elections National Elections Presidential elections Midterm elections Off-year elections Primary elections Presidential primary Elections by State and Territory Alabama Alaska Arizona Arkansas California Colorado Connecticut Delaware District of Columbia Florida Georgia Hawaii Idaho Illinois Indiana Iowa Kansas Kentucky Louisiana Maine Maryland Massachusetts Michigan Minnesota Mississippi Missouri Montana Nebraska Nevada New Hampshire New Jersey New Mexico New York North Carolina North Dakota Ohio Oklahoma Oregon Pennsylvania Rhode Island South Carolina South Dakota Tennessee Texas Utah Vermont Virginia Washington West Virginia Wisconsin Wyoming American Samoa Guam Northern Mariana Islands Puerto Rico U.S. Virgin Islands Washington, D.C. (List of Elections) Political parties Democratic Republican Third parties Libertarian Green List of political parties Political ideologies Conservatism history Black Neo- Paleo- Social Traditionalist Liberalism Modern Progressivism Abolitionism Constitutionalism Environmentalism Feminism Libertarianism Monarchism Populism Protectionism Republicanism Socialism Anarchism Individualist anarchism Political culture Political polarization Federalism State State government Political ideology of states in the United States Governors Legislatures (list) State courts local government Foreign relations Department of State Secretary of State: Antony Blinken Diplomatic missions of / in the United States Nationality law Passports Visa requirements Visa policy United States and the United Nations United Nations Security Council P5 NATO G20 G7 Russia China India Japan Canada United Kingdom European Union Latin America Arab League Greece  United States portal Politics portal Constitutional lawof the United States Overview Articles Amendments History Judicial review Principles Separation of powers Individual rights Rule of law Federalism Republicanism Equal footing Strict scrutiny Government structure Legislative branch Executive branch Judicial branch State government Local government Individual rights Freedom of religion Freedom of speech Freedom of the press Freedom of assembly Right to petition Freedom of association Right to keep and bear arms Right to trial by jury Criminal procedural rights Right to privacy Freedom from slavery Due process Equal protection Citizenship Voting rights Comprehensible rules Theory Living Constitution Originalism Substantive due process Political process theory Purposivism Textualism Strict constructionism Common good constitutionalism The power of the presidency has grown substantially since the first president, George Washington, took office in 1789. While presidential power has ebbed and flowed over time, the presidency has played an increasingly significant role in American political life since the beginning of the 20th century, with notable expansion during the presidency of Franklin D. Roosevelt. In modern times, the president is one of the world's most powerful political figures – the leader of the only remaining global superpower. As the leader of the nation with the largest economy by nominal GDP, the president possesses significant domestic and international hard and soft power. Article II of the Constitution establishes the executive branch of the federal government and vests executive power in the president. The power includes the execution and enforcement of federal law and the responsibility to appoint federal executive, diplomatic, regulatory, and judicial officers. Based on constitutional provisions empowering the president to appoint and receive ambassadors and conclude treaties with foreign powers, and on subsequent laws enacted by Congress, the modern presidency has primary responsibility for conducting U.S. foreign policy. The role includes responsibility for directing the world's most expensive military, which has the second largest nuclear arsenal. The president also plays a leading role in federal legislation and domestic policymaking. As part of the system of separation of powers, Article I, Section 7 of the Constitution gives the president the power to sign or veto federal legislation. Since modern presidents are typically viewed as leaders of their political parties, major policymaking is significantly shaped by the outcome of presidential elections, with presidents taking an active role in promoting their policy priorities to members of Congress who are often electorally dependent on the president. In recent decades, presidents have also made increasing use of executive orders, agency regulations, and judicial appointments to shape domestic policy. The president is elected indirectly through the Electoral College to a four-year term, along with the vice president. Under the Twenty-second Amendment, ratified in 1951, no person who has been elected to two presidential terms may be elected to a third. In addition, nine vice presidents have become president by virtue of a president's intra-term death or resignation. In all, 45 individuals have served 46 presidencies spanning 58 four-year terms. Joe Biden is the 46th and current president of the United States, having assumed office on January 20, 2021. This article is issued from Wikipedia. The text is licensed under Creative Commons - Attribution - Sharealike. Additional terms may apply for the media files."
Protein,"Protein Proteins are large biomolecules and macromolecules that comprise one or more long chains of amino acid residues. Proteins perform a vast array of functions within organisms, including catalysing metabolic reactions, DNA replication, responding to stimuli, providing structure to cells and organisms, and transporting molecules from one location to another. Proteins differ from one another primarily in their sequence of amino acids, which is dictated by the nucleotide sequence of their genes, and which usually results in protein folding into a specific 3D structure that determines its activity. A linear chain of amino acid residues is called a polypeptide. A protein contains at least one long polypeptide. Short polypeptides, containing less than 20–30 residues, are rarely considered to be proteins and are commonly called peptides. The individual amino acid residues are bonded together by peptide bonds and adjacent amino acid residues. The sequence of amino acid residues in a protein is defined by the sequence of a gene, which is encoded in the genetic code. In general, the genetic code specifies 20 standard amino acids; but in certain organisms the genetic code can include selenocysteine and—in certain archaea—pyrrolysine. Shortly after or even during synthesis, the residues in a protein are often chemically modified by post-translational modification, which alters the physical and chemical properties, folding, stability, activity, and ultimately, the function of the proteins. Some proteins have non-peptide groups attached, which can be called prosthetic groups or cofactors. Proteins can also work together to achieve a particular function, and they often associate to form stable protein complexes. Once formed, proteins only exist for a certain period and are then degraded and recycled by the cell's machinery through the process of protein turnover. A protein's lifespan is measured in terms of its half-life and covers a wide range. They can exist for minutes or years with an average lifespan of 1–2 days in mammalian cells. Abnormal or misfolded proteins are degraded more rapidly either due to being targeted for destruction or due to being unstable. Like other biological macromolecules such as polysaccharides and nucleic acids, proteins are essential parts of organisms and participate in virtually every process within cells. Many proteins are enzymes that catalyse biochemical reactions and are vital to metabolism. Proteins also have structural or mechanical functions, such as actin and myosin in muscle and the proteins in the cytoskeleton, which form a system of scaffolding that maintains cell shape. Other proteins are important in cell signaling, immune responses, cell adhesion, and the cell cycle. In animals, proteins are needed in the diet to provide the essential amino acids that cannot be synthesized. Digestion breaks the proteins down for metabolic use. Proteins may be purified from other cellular components using a variety of techniques such as ultracentrifugation, precipitation, electrophoresis, and chromatography; the advent of genetic engineering has made possible a number of methods to facilitate purification. Methods commonly used to study protein structure and function include immunohistochemistry, site-directed mutagenesis, X-ray crystallography, nuclear magnetic resonance and mass spectrometry. This article is issued from Wikipedia. The text is licensed under Creative Commons - Attribution - Sharealike. Additional terms may apply for the media files."
Rodent,"Rodent Rodents (from Latin rodere, 'to gnaw') are mammals of the order Rodentia (/roʊˈdɛnʃə/), which are characterized by a single pair of continuously growing incisors in each of the upper and lower jaws. About 40% of all mammal species are rodents. They are native to all major land masses except for New Zealand, Antarctica, and several oceanic islands, though they have subsequently been introduced to most of these land masses by human activity. RodentTemporal range: CapybaraSpringhareGolden-mantled ground squirrelNorth American beaverHouse mouse Scientific classification Domain: Eukaryota Kingdom: Animalia Phylum: Chordata Class: Mammalia Clade: Simplicidentata Order: RodentiaBowdich, 1821 Suborders Anomaluromorpha Castorimorpha Hystricomorpha (incl. Caviomorpha) Myomorpha Sciuromorpha Combined range of all rodent species (not including introduced populations) Rodents are extremely diverse in their ecology and lifestyles and can be found in almost every terrestrial habitat, including human-made environments. Species can be arboreal, fossorial (burrowing), saltatorial/richochetal (leaping on their hind legs), or semiaquatic. However, all rodents share several morphological features, including having only a single upper and lower pair of ever-growing incisors. Well-known rodents include mice, rats, squirrels, prairie dogs, porcupines, beavers, guinea pigs, and hamsters. Rabbits, hares, and pikas, who also have incisors that grow continuously (but have two pairs of upper incisors instead of one), were once included with them, but are now considered to be in a separate order, the Lagomorpha. Nonetheless, Rodentia and Lagomorpha are sister groups, sharing a single common ancestor and forming the clade of Glires. Most rodents are small animals with robust bodies, short limbs, and long tails. They use their sharp incisors to gnaw food, excavate burrows, and defend themselves. Most eat seeds or other plant material, but some have more varied diets. They tend to be social animals and many species live in societies with complex ways of communicating with each other. Mating among rodents can vary from monogamy, to polygyny, to promiscuity. Many have litters of underdeveloped, altricial young, while others are precocial (relatively well developed) at birth. The rodent fossil record dates back to the Paleocene on the supercontinent of Laurasia. Rodents greatly diversified in the Eocene, as they spread across continents, sometimes even crossing oceans. Rodents reached both South America and Madagascar from Africa and, until the arrival of Homo sapiens, were the only terrestrial placental mammals to reach and colonize Australia. Rodents have been used as food, for clothing, as pets, and as laboratory animals in research. Some species, in particular, the brown rat, the black rat, and the house mouse, are serious pests, eating and spoiling food stored by humans and spreading diseases. Accidentally introduced species of rodents are often considered to be invasive and have caused the extinction of numerous species, such as island birds, the dodo being an example, previously isolated from land-based predators. This article is issued from Wikipedia. The text is licensed under Creative Commons - Attribution - Sharealike. Additional terms may apply for the media files."
Sea,"Sea A sea is a large body of salty water. There are particular seas and the sea. The sea commonly refers to the ocean, the wider body of seawater. Particular seas are either marginal seas, second-order sections of the oceanic sea (e.g. the Mediterranean Sea), or certain large, nearly landlocked bodies of water. The salinity of water bodies varies widely, being lower near the surface and the mouths of large rivers and higher in the depths of the ocean; however, the relative proportions of dissolved salts vary little across the oceans. The most abundant solid dissolved in seawater is sodium chloride. The water also contains salts of magnesium, calcium, potassium, and mercury, amongst many other elements, some in minute concentrations. The ocean moderates Earth's climate and has important roles in the water, carbon, and nitrogen cycles. The surface of water interacts with the atmosphere, exchanging properties such as particles and temperature, as well as currents. Surface currents are the water currents that are produced by the atmosphere's currents and its winds blowing over the surface of the water, producing wind waves, setting up through drag slow but stable circulations of water, as in the case of the ocean sustaining deep-sea ocean currents. Deep-sea currents, known together as the global conveyor belt, carry cold water from near the poles to every ocean and significantly influence Earth's climate. Tides, the generally twice-daily rise and fall of sea levels, are caused by Earth's rotation and the gravitational effects of the Moon and, to a lesser extent, of the Sun. Tides may have a very high range in bays or estuaries. Submarine earthquakes arising from tectonic plate movements under the oceans can lead to destructive tsunamis, as can volcanoes, huge landslides, or the impact of large meteorites. A wide variety of organisms, including bacteria, protists, algae, plants, fungi, and animals, lives in the seas, which offers a wide range of marine habitats and ecosystems, ranging vertically from the sunlit surface and shoreline to the great depths and pressures of the cold, dark abyssal zone, and in latitude from the cold waters under polar ice caps to the warm waters of coral reefs in tropical regions. Many of the major groups of organisms evolved in the sea and life may have started there. The seas have been an integral element for humans throughout history and culture. Humans harnessing and studying the seas have been recorded since ancient times, and evidenced well into prehistory, while its modern scientific study is called oceanography and maritime space is governed by the law of the sea, with admiralty law regulating human interactions at sea. The seas provide substantial supplies of food for humans, mainly fish, but also shellfish, mammals and seaweed, whether caught by fishermen or farmed underwater. Other human uses of the seas include trade, travel, mineral extraction, power generation, warfare, and leisure activities such as swimming, sailing, and scuba diving. Many of these activities create marine pollution. This article is issued from Wikipedia. The text is licensed under Creative Commons - Attribution - Sharealike. Additional terms may apply for the media files."
